{"id":"0f7a5e11-2bce-4d10-9b6f-3a4d5e6f7096","name":"Tint Retouch","schema":"appname.action.v1","steps":[{"command":{"id":"0f7a5e11-2bce-4d10-9b6f-3a4d5e6f7093","kind":"layer.set_props","params":{"opacity":0.5},"reversible":true,"schema":"appname.command.v1","target":{"channelId":null,"layerId":"0f7a5e11-2bce-4d10-9b6f-3a4d5e6f7092","maskId":null}},"recordedTarget":{"layerName":"Retouch","treeIndex":1}}]}